{
  "$schema": "http://json-schema.org/draft-07/schema#",
  "$ref": "#/definitions/Artifact",
  "definitions": {
    "Artifact": {
      "type": "object",
      "properties": {
        "id": {
          "type": "string"
        },
        "name": {
          "type": "string"
        },
        "minRarity": {
          "type": "number"
        },
        "maxRarity": {
          "type": "number"
        },
        "flower": {
          "type": "object",
          "properties": {
            "id": {
              "type": "string"
            },
            "name": {
              "type": "string"
            },
            "description": {
              "type": "string"
            }
          },
          "required": [
            "id",
            "name"
          ],
          "additionalProperties": false
        },
        "plume": {
          "type": "object",
          "properties": {
            "id": {
              "type": "string"
            },
            "name": {
              "type": "string"
            },
            "description": {
              "type": "string"
            }
          },
          "required": [
            "id",
            "name"
          ],
          "additionalProperties": false
        },
        "sands": {
          "type": "object",
          "properties": {
            "id": {
              "type": "string"
            },
            "name": {
              "type": "string"
            },
            "description": {
              "type": "string"
            }
          },
          "required": [
            "id",
            "name"
          ],
          "additionalProperties": false
        },
        "goblet": {
          "type": "object",
          "properties": {
            "id": {
              "type": "string"
            },
            "name": {
              "type": "string"
            },
            "description": {
              "type": "string"
            }
          },
          "required": [
            "id",
            "name"
          ],
          "additionalProperties": false
        },
        "circlet": {
          "type": "object",
          "properties": {
            "id": {
              "type": "string"
            },
            "name": {
              "type": "string"
            },
            "description": {
              "type": "string"
            }
          },
          "required": [
            "id",
            "name"
          ],
          "additionalProperties": false
        },
        "onePiece": {
          "type": "string"
        },
        "twoPiece": {
          "type": "string"
        },
        "fourPiece": {
          "type": "string"
        },
        "version": {
          "type": "string"
        }
      },
      "required": [
        "id",
        "name",
        "minRarity",
        "maxRarity"
      ],
      "additionalProperties": false
    }
  }
}